{
  "schema_version": "1.0.0",
  "profile_id": "base",
  "name": "Base communication guidance",
  "version": "1.0.0",
  "description": "Provider-neutral communication-quality principles shared by all guidance profiles.",
  "extends": null,
  "applicability": {
    "deck_types": ["any"],
    "audiences": ["any"]
  },
  "deck_reasoning": {
    "principles": [
      "Organize the deck around its stated objective and audience.",
      "Give every slide a clear reason to exist within the deck.",
      "Preserve authoritative evidence and explicit constraints."
    ],
    "diagnostics": [
      "Can the audience follow why each slide follows the previous one?",
      "Does the deck cover its authoritative evidence without unsupported invention?"
    ],
    "storyline_archetypes": {},
    "recommended_outputs": ["audience_question", "governing_answer", "argument_spine", "message_chain"]
  },
  "slide_reasoning": {
    "principles": [
      "Give each information-bearing slide one governing communication job.",
      "Preserve the semantic relationships supported by the source material."
    ],
    "diagnostics": [
      "Can the audience identify the slide's purpose?",
      "Does every major element contribute to that purpose?"
    ],
    "recommended_outputs": ["dominant_claim", "semantic_relationships", "hierarchy", "reading_logic", "visual_obligations"]
  },
  "semantic_output_guidance": {
    "deck_fields": ["audience_question", "governing_answer", "argument_spine", "slide_roles", "message_chain"],
    "slide_fields": ["audience_question", "dominant_claim", "role_in_deck_argument", "argument_structure", "evidence_bindings", "visual_obligations"],
    "optional_fields_are_contextual": true
  },
  "visual_communication": {
    "principles": [
      "Let semantic relationships drive visual relationships.",
      "Make emphasis correspond to communication importance."
    ],
    "diagnostics": [
      "Are the required semantic relationships visually recoverable?",
      "Does visual prominence correspond to semantic importance?"
    ]
  },
  "writing": {
    "principles": [
      "Use clear and economical language.",
      "Avoid unsupported claims and redundant exposition."
    ],
    "title_policy": "Use titles that accurately communicate the slide's role and message."
  },
  "review": {
    "questions": [
      "Is the main communication purpose clear?",
      "Is the content faithful to the authoritative sources?",
      "Are important relationships and hierarchy apparent?"
    ],
    "deck_diagnostics": [
      "Does the deck progress coherently?",
      "Are terminology and evidence consistent across slides?"
    ]
  },
  "anti_patterns": [
    "content without a governing purpose",
    "unsupported visual prominence",
    "repetition that does not advance communication"
  ],
  "design_freedom": [
    "These principles define communication quality and do not prescribe a fixed visual grammar.",
    "Do not prescribe coordinates, component counts, or page topology unless required by content or an explicit user constraint.",
    "The image-generation model retains responsibility for genuine visual invention."
  ],
  "exclusions": [
    "fonts",
    "colors",
    "slide dimensions",
    "header and footer geometry",
    "density profile",
    "icon library",
    "visual reference library",
    "known component library",
    "reconstruction mechanics"
  ]
}
